No.,Time,Source,Destination,Protocol,Length,Info,,,,,,,,,,,,,Time 2,Time 1,Delay 2,Delay 1,Jitter
307,19.54712054,192.168.1.1,192.168.1.2,TCP,74,54382  >  5001 [SYN] Seq=0 Win=42340 Len=0 MSS=1460 SACK_PERM=1 TSval=316238665 TSecr=0 WS=512,,,,,,,,,,,,,19.54732197,19.54712054,0.006278598,0.000201428,0.00607717
308,19.54732197,192.168.1.2,192.168.1.1,TCP,74,"5001  >  54382 [SYN, ACK] Seq=0 Ack=1 Win=43440 Len=0 MSS=1460 SACK_PERM=1 TSval=2680708445 TSecr=316238665 WS=512",,,,,,,,,,,,,19.55360057,19.54732197,0.001540543,0.006278598,-0.004738055
309,19.55360057,192.168.1.1,192.168.1.2,TCP,66,54382  >  5001 [ACK] Seq=1 Ack=1 Win=42496 Len=0 TSval=316238678 TSecr=2680708445,,,,,,,,,,,,,19.55514111,19.55360057,0.002260461,0.001540543,0.000719918
310,19.55514111,192.168.1.1,192.168.1.2,TCP,66,"54382  >  5001 [FIN, ACK] Seq=1 Ack=1 Win=42496 Len=0 TSval=316238679 TSecr=2680708445",,,,,,,,,,,,,19.55740157,19.55514111,7.24E-05,0.002260461,-0.00218807
311,19.55740157,192.168.1.2,192.168.1.1,TCP,66,"5001  >  54382 [FIN, ACK] Seq=1 Ack=2 Win=43520 Len=0 TSval=2680708456 TSecr=316238679",,,,,,,,,,,,,19.55747397,19.55740157,0.006269779,7.24E-05,0.006197388
312,19.55747397,192.168.1.1,192.168.1.2,TCP,66,54382  >  5001 [ACK] Seq=2 Ack=2 Win=42496 Len=0 TSval=316238682 TSecr=2680708456,,,,,,,,,,,,,19.56374374,19.55747397,3.98E-05,0.006269779,-0.006229997
313,19.56374374,192.168.1.1,192.168.1.2,TCP,74,54384  >  5001 [SYN] Seq=0 Win=42340 Len=0 MSS=1460 SACK_PERM=1 TSval=316238688 TSecr=0 WS=512,,,,,,,,,,,,,19.56378353,19.56374374,6.98E-05,3.98E-05,3.00E-05
314,19.56378353,192.168.1.2,192.168.1.1,TCP,74,"5001  >  54384 [SYN, ACK] Seq=0 Ack=1 Win=43440 Len=0 MSS=1460 SACK_PERM=1 TSval=2680708462 TSecr=316238688 WS=512",,,,,,,,,,,,,19.56385333,19.56378353,0.000202687,6.98E-05,0.000132884
315,19.56385333,192.168.1.1,192.168.1.2,TCP,66,54384  >  5001 [ACK] Seq=1 Ack=1 Win=42496 Len=0 TSval=316238688 TSecr=2680708462,,,,,,,,,,,,,19.56405602,19.56385333,2.23E-05,0.000202687,-0.00018034
316,19.56405602,192.168.1.1,192.168.1.2,TCP,7306,"54384  >  5001 [PSH, ACK] Seq=1 Ack=1 Win=42496 Len=7240 TSval=316238688 TSecr=2680708462",,,,,,,,,,,,,19.56407836,19.56405602,2.28E-05,2.23E-05,4.98E-07
317,19.56407836,192.168.1.2,192.168.1.1,TCP,66,5001  >  54384 [ACK] Seq=1 Ack=7241 Win=39936 Len=0 TSval=2680708462 TSecr=316238688,,,,,,,,,,,,,19.56410121,19.56407836,9.02E-06,2.28E-05,-1.38E-05
318,19.56410121,192.168.1.1,192.168.1.2,TCP,7306,"54384  >  5001 [PSH, ACK] Seq=7241 Ack=1 Win=42496 Len=7240 TSval=316238688 TSecr=2680708462",,,,,,,,,,,,,19.56411023,19.56410121,0.000482275,9.02E-06,0.000473256
319,19.56411023,192.168.1.2,192.168.1.1,TCP,66,5001  >  54384 [ACK] Seq=1 Ack=14481 Win=35328 Len=0 TSval=2680708462 TSecr=316238688,,,,,,,,,,,,,19.5645925,19.56411023,2.54E-05,0.000482275,-0.000456835
320,19.5645925,192.168.1.1,192.168.1.2,TCP,14546,"54384  >  5001 [PSH, ACK] Seq=14481 Ack=1 Win=42496 Len=14480 TSval=316238689 TSecr=2680708462",,,,,,,,,,,,,19.56461794,19.5645925,0.000112301,2.54E-05,8.69E-05
321,19.56461794,192.168.1.2,192.168.1.1,TCP,66,5001  >  54384 [ACK] Seq=1 Ack=28961 Win=35840 Len=0 TSval=2680708463 TSecr=316238689,,,,,,,,,,,,,19.56473024,19.56461794,2.03E-05,0.000112301,-9.20E-05
322,19.56473024,192.168.1.1,192.168.1.2,TCP,7306,"54384  >  5001 [PSH, ACK] Seq=28961 Ack=1 Win=42496 Len=7240 TSval=316238689 TSecr=2680708462",,,,,,,,,,,,,19.56475058,19.56473024,2.32E-05,2.03E-05,2.90E-06
323,19.56475058,192.168.1.2,192.168.1.1,TCP,66,5001  >  54384 [ACK] Seq=1 Ack=36201 Win=31744 Len=0 TSval=2680708463 TSecr=316238689,,,,,,,,,,,,,19.56477381,19.56475058,1.25E-05,2.32E-05,-1.08E-05
324,19.56477381,192.168.1.1,192.168.1.2,TCP,7306,"54384  >  5001 [PSH, ACK] Seq=36201 Ack=1 Win=42496 Len=7240 TSval=316238689 TSecr=2680708462",,,,,,,,,,,,,19.56478629,19.56477381,0.000153961,1.25E-05,0.000141481
325,19.56478629,192.168.1.2,192.168.1.1,TCP,66,5001  >  54384 [ACK] Seq=1 Ack=43441 Win=27648 Len=0 TSval=2680708463 TSecr=316238689,,,,,,,,,,,,,19.56494025,19.56478629,2.98E-05,0.000153961,-0.000124187
326,19.56494025,192.168.1.1,192.168.1.2,TCP,14546,"54384  >  5001 [PSH, ACK] Seq=43441 Ack=1 Win=42496 Len=14480 TSval=316238689 TSecr=2680708463",,,,,,,,,,,,,19.56497003,19.56494025,0.000885376,2.98E-05,0.000855602
327,19.56497003,192.168.1.1,192.168.1.2,TCP,13234,"[TCP Window Full] 54384  >  5001 [PSH, ACK] Seq=57921 Ack=1 Win=42496 Len=13168 TSval=316238689 TSecr=2680708463",,,,,,,,,,,,,19.5658554,19.56497003,-0.025392635,0.000885376,-0.026278011
328,19.5658554,192.168.1.2,192.168.1.1,TCP,66,5001  >  54384 [ACK] Seq=1 Ack=71089 Win=42496 Len=0 TSval=2680708464 TSecr=316238689,,,,,,,,,,,,,19.54046277,19.5658554,0.025479171,-0.025392635,0.050871806
329,19.54046277,192.168.1.1,192.168.1.2,TCP,74,[TCP Retransmission] 54382  >  5001 [SYN] Seq=0 Win=42340 Len=0 MSS=1460 SACK_PERM=1 TSval=316238665 TSecr=0 WS=512,,,,,,,,,,,,,19.56594194,19.54046277,-0.012393267,0.025479171,-0.037872438
330,19.56594194,192.168.1.1,192.168.1.2,TCP,8618,"54384  >  5001 [PSH, ACK] Seq=71089 Ack=1 Win=42496 Len=8552 TSval=316238690 TSecr=2680708464",,,,,,,,,,,,,19.55354867,19.56594194,4.51E-05,-0.012393267,0.012438397
331,19.55354867,192.168.1.2,192.168.1.1,TCP,74,"[TCP Retransmission] 5001  >  54382 [SYN, ACK] Seq=0 Ack=1 Win=43440 Len=0 MSS=1460 SACK_PERM=1 TSval=2680708445 TSecr=316238665 WS=512",,,,,,,,,,,,,19.5535938,19.55354867,0.001523551,4.51E-05,0.001478421
332,19.5535938,192.168.1.1,192.168.1.2,TCP,66,[TCP Keep-Alive] 54382  >  5001 [ACK] Seq=1 Ack=1 Win=42496 Len=0 TSval=316238678 TSecr=2680708445,,,,,,,,,,,,,19.55511735,19.5535938,0.002306175,0.001523551,0.000782624
333,19.55511735,192.168.1.1,192.168.1.2,TCP,66,"[TCP Retransmission] 54382  >  5001 [FIN, ACK] Seq=1 Ack=1 Win=42496 Len=0 TSval=316238679 TSecr=2680708445",,,,,,,,,,,,,19.55742353,19.55511735,3.61E-05,0.002306175,-0.002270104
334,19.55742353,192.168.1.2,192.168.1.1,TCP,66,"[TCP Out-Of-Order] 5001  >  54382 [FIN, ACK] Seq=1 Ack=2 Win=43520 Len=0 TSval=2680708456 TSecr=316238679",,,,,,,,,,,,,19.5574596,19.55742353,0.008495645,3.61E-05,0.008459574
335,19.5574596,192.168.1.1,192.168.1.2,TCP,66,54382  >  5001 [ACK] Seq=2 Ack=2 Win=42496 Len=0 TSval=316238682 TSecr=2680708456,,,,,,,,,,,,,19.56595524,19.5574596,-0.002273629,0.008495645,-0.010769274
336,19.56595524,192.168.1.1,192.168.1.2,TCP,21786,"54384  >  5001 [PSH, ACK] Seq=79641 Ack=1 Win=42496 Len=21720 TSval=316238690 TSecr=2680708464",,,,,,,,,,,,,19.56368162,19.56595524,0.000106035,-0.002273629,0.002379664
337,19.56368162,192.168.1.1,192.168.1.2,TCP,74,[TCP Retransmission] 54384  >  5001 [SYN] Seq=0 Win=42340 Len=0 MSS=1460 SACK_PERM=1 TSval=316238688 TSecr=0 WS=512,,,,,,,,,,,,,19.56378765,19.56368162,6.33E-05,0.000106035,-4.27E-05
338,19.56378765,192.168.1.2,192.168.1.1,TCP,74,"[TCP Out-Of-Order] 5001  >  54384 [SYN, ACK] Seq=0 Ack=1 Win=43440 Len=0 MSS=1460 SACK_PERM=1 TSval=2680708462 TSecr=316238688 WS=512",,,,,,,,,,,,,19.56385099,19.56378765,0.002115606,6.33E-05,0.002052268
339,19.56385099,192.168.1.1,192.168.1.2,TCP,66,54384  >  5001 [ACK] Seq=1 Ack=1 Win=42496 Len=0 TSval=316238688 TSecr=2680708462,,,,,,,,,,,,,19.56596659,19.56385099,2.09E-05,0.002115606,-0.002094657
340,19.56596659,192.168.1.1,192.168.1.2,TCP,11650,"54384  >  5001 [PSH, ACK] Seq=101361 Ack=1 Win=42496 Len=11584 TSval=316238690 TSecr=2680708464",,,,,,,,,,,,,19.56598754,19.56596659,-0.00194183,2.09E-05,-0.001962779
341,19.56598754,192.168.1.2,192.168.1.1,TCP,66,5001  >  54384 [ACK] Seq=1 Ack=79641 Win=59392 Len=0 TSval=2680708464 TSecr=316238690,,,,,,,,,,,,,19.56404571,19.56598754,3.56E-05,-0.00194183,0.001977467
342,19.56404571,192.168.1.1,192.168.1.2,TCP,7306,"[TCP Spurious Retransmission] 54384  >  5001 [PSH, ACK] Seq=1 Ack=1 Win=42496 Len=7240 TSval=316238688 TSecr=2680708462",,,,,,,,,,,,,19.56408135,19.56404571,0.001930725,3.56E-05,0.001895088
343,19.56408135,192.168.1.2,192.168.1.1,TCP,66,5001  >  54384 [ACK] Seq=1 Ack=7241 Win=39936 Len=0 TSval=2680708462 TSecr=316238688,,,,,,,,,,,,,19.56601208,19.56408135,-0.001914978,0.001930725,-0.003845703
344,19.56601208,192.168.1.1,192.168.1.2,TCP,10202,"54384  >  5001 [PSH, ACK] Seq=112945 Ack=1 Win=42496 Len=10136 TSval=316238690 TSecr=2680708464",,,,,,,,,,,,,19.5640971,19.56601208,1.58E-05,-0.001914978,0.001930812
345,19.5640971,192.168.1.1,192.168.1.2,TCP,7306,"[TCP Retransmission] 54384  >  5001 [PSH, ACK] Seq=7241 Ack=1 Win=42496 Len=7240 TSval=316238688 TSecr=2680708462",,,,,,,,,,,,,19.56411293,19.5640971,0.001910256,1.58E-05,0.001894422
346,19.56411293,192.168.1.2,192.168.1.1,TCP,66,5001  >  54384 [ACK] Seq=1 Ack=14481 Win=35328 Len=0 TSval=2680708462 TSecr=316238688,,,,,,,,,,,,,19.56602319,19.56411293,-0.00145357,0.001910256,-0.003363826
347,19.56602319,192.168.1.1,192.168.1.2,TCP,14546,"54384  >  5001 [PSH, ACK] Seq=123081 Ack=1 Win=42496 Len=14480 TSval=316238690 TSecr=2680708464",,,,,,,,,,,,,19.56456962,19.56602319,0.001469439,-0.00145357,0.002923009
348,19.56456962,192.168.1.1,192.168.1.2,TCP,14546,"[TCP Retransmission] 54384  >  5001 [PSH, ACK] Seq=14481 Ack=1 Win=42496 Len=14480 TSval=316238689 TSecr=2680708462",,,,,,,,,,,,,19.56603906,19.56456962,-0.001383668,0.001469439,-0.002853107
349,19.56603906,192.168.1.2,192.168.1.1,TCP,66,5001  >  54384 [ACK] Seq=1 Ack=101361 Win=102912 Len=0 TSval=2680708464 TSecr=316238690,,,,,,,,,,,,,19.56465539,19.56603906,0.001401106,-0.001383668,0.002784774
350,19.56465539,192.168.1.2,192.168.1.1,TCP,66,5001  >  54384 [ACK] Seq=1 Ack=28961 Win=35840 Len=0 TSval=2680708463 TSecr=316238689,,,,,,,,,,,,,19.56605649,19.56465539,1.04E-05,0.001401106,-0.001390733
351,19.56605649,192.168.1.1,192.168.1.2,TCP,7306,"54384  >  5001 [PSH, ACK] Seq=137561 Ack=1 Win=42496 Len=7240 TSval=316238690 TSecr=2680708464",,,,,,,,,,,,,19.56606687,19.56605649,-0.001387762,1.04E-05,-0.001398135
352,19.56606687,192.168.1.2,192.168.1.1,TCP,66,5001  >  54384 [ACK] Seq=1 Ack=112945 Win=125952 Len=0 TSval=2680708464 TSecr=316238690,,,,,,,,,,,,,19.56467911,19.56606687,7.60E-05,-0.001387762,0.00146373
353,19.56467911,192.168.1.1,192.168.1.2,TCP,7306,"[TCP Spurious Retransmission] 54384  >  5001 [PSH, ACK] Seq=28961 Ack=1 Win=42496 Len=7240 TSval=316238689 TSecr=2680708462",,,,,,,,,,,,,19.56475507,19.56467911,1.36E-05,7.60E-05,-6.24E-05
354,19.56475507,192.168.1.2,192.168.1.1,TCP,66,5001  >  54384 [ACK] Seq=1 Ack=36201 Win=31744 Len=0 TSval=2680708463 TSecr=316238689,,,,,,,,,,,,,19.56476863,19.56475507,0.001323327,1.36E-05,0.001309771
355,19.56476863,192.168.1.1,192.168.1.2,TCP,7306,"[TCP Retransmission] 54384  >  5001 [PSH, ACK] Seq=36201 Ack=1 Win=42496 Len=7240 TSval=316238689 TSecr=2680708462",,,,,,,,,,,,,19.56609196,19.56476863,-0.001302738,0.001323327,-0.002626065
356,19.56609196,192.168.1.1,192.168.1.2,TCP,21786,"54384  >  5001 [PSH, ACK] Seq=144801 Ack=1 Win=42496 Len=21720 TSval=316238690 TSecr=2680708464",,,,,,,,,,,,,19.56478922,19.56609196,0.001312738,-0.001302738,0.002615476
357,19.56478922,192.168.1.2,192.168.1.1,TCP,66,5001  >  54384 [ACK] Seq=1 Ack=43441 Win=27648 Len=0 TSval=2680708463 TSecr=316238689,,,,,,,,,,,,,19.56610196,19.56478922,1.22E-05,0.001312738,-0.001300536
358,19.56610196,192.168.1.1,192.168.1.2,TCP,5858,"54384  >  5001 [PSH, ACK] Seq=166521 Ack=1 Win=42496 Len=5792 TSval=316238690 TSecr=2680708464",,,,,,,,,,,,,19.56611416,19.56610196,1.34E-05,1.22E-05,1.22E-06
359,19.56611416,192.168.1.2,192.168.1.1,TCP,66,5001  >  54384 [ACK] Seq=1 Ack=123081 Win=146432 Len=0 TSval=2680708464 TSecr=316238690,,,,,,,,,,,,,19.56612758,19.56611416,-0.001200515,1.34E-05,-0.001213935
360,19.56612758,192.168.1.2,192.168.1.1,TCP,66,5001  >  54384 [ACK] Seq=1 Ack=137561 Win=158208 Len=0 TSval=2680708464 TSecr=316238690,,,,,,,,,,,,,19.56492706,19.56612758,3.45E-05,-0.001200515,0.001235047
361,19.56492706,192.168.1.1,192.168.1.2,TCP,14546,"[TCP Spurious Retransmission] 54384  >  5001 [PSH, ACK] Seq=43441 Ack=1 Win=42496 Len=14480 TSval=316238689 TSecr=2680708463",,,,,,,,,,,,,19.5649616,19.56492706,0.000917591,3.45E-05,0.000883059
362,19.5649616,192.168.1.1,192.168.1.2,TCP,13234,"[TCP Spurious Retransmission] 54384  >  5001 [PSH, ACK] Seq=57921 Ack=1 Win=42496 Len=13168 TSval=316238689 TSecr=2680708463",,,,,,,,,,,,,19.56587919,19.5649616,4.44E-05,0.000917591,-0.000873231
363,19.56587919,192.168.1.2,192.168.1.1,TCP,66,5001  >  54384 [ACK] Seq=1 Ack=71089 Win=42496 Len=0 TSval=2680708464 TSecr=316238689,,,,,,,,,,,,,19.56592355,19.56587919,4.97E-06,4.44E-05,-3.94E-05
364,19.56592355,192.168.1.1,192.168.1.2,TCP,8618,"[TCP Retransmission] 54384  >  5001 [PSH, ACK] Seq=71089 Ack=1 Win=42496 Len=8552 TSval=316238690 TSecr=2680708464",,,,,,,,,,,,,19.56592852,19.56592355,4.74E-06,4.97E-06,-2.32E-07
365,19.56592852,192.168.1.1,192.168.1.2,TCP,21786,"[TCP Retransmission] 54384  >  5001 [PSH, ACK] Seq=79641 Ack=1 Win=42496 Len=21720 TSval=316238690 TSecr=2680708464",,,,,,,,,,,,,19.56593326,19.56592852,0.000218641,4.74E-06,0.000213899
366,19.56593326,192.168.1.1,192.168.1.2,TCP,11650,"[TCP Retransmission] 54384  >  5001 [PSH, ACK] Seq=101361 Ack=1 Win=42496 Len=11584 TSval=316238690 TSecr=2680708464",,,,,,,,,,,,,19.5661519,19.56593326,-0.000161401,0.000218641,-0.000380042
367,19.5661519,192.168.1.1,192.168.1.2,TCP,15994,"54384  >  5001 [PSH, ACK] Seq=172313 Ack=1 Win=42496 Len=15928 TSval=316238690 TSecr=2680708464",,,,,,,,,,,,,19.5659905,19.5661519,9.00E-06,-0.000161401,0.000170405
368,19.5659905,192.168.1.2,192.168.1.1,TCP,66,5001  >  54384 [ACK] Seq=1 Ack=79641 Win=59392 Len=0 TSval=2680708464 TSecr=316238690,,,,,,,,,,,,,19.56599951,19.5659905,0.000162757,9.00E-06,0.000153753
369,19.56599951,192.168.1.1,192.168.1.2,TCP,10202,"[TCP Retransmission] 54384  >  5001 [PSH, ACK] Seq=112945 Ack=1 Win=42496 Len=10136 TSval=316238690 TSecr=2680708464",,,,,,,,,,,,,19.56616226,19.56599951,0.001398378,0.000162757,0.001235621
370,19.56616226,192.168.1.1,192.168.1.2,TCP,10202,"54384  >  5001 [PSH, ACK] Seq=188241 Ack=1 Win=42496 Len=10136 TSval=316238690 TSecr=2680708464",,,,,,,,,,,,,19.56756064,19.56616226,-0.001555982,0.001398378,-0.00295436
371,19.56756064,192.168.1.2,192.168.1.1,TCP,66,5001  >  54384 [ACK] Seq=1 Ack=198377 Win=158208 Len=0 TSval=2680708466 TSecr=316238690,,,,,,,,,,,,,19.56600466,19.56756064,3.69E-05,-0.001555982,0.001592884
372,19.56600466,192.168.1.1,192.168.1.2,TCP,14546,"[TCP Spurious Retransmission] 54384  >  5001 [PSH, ACK] Seq=123081 Ack=1 Win=42496 Len=14480 TSval=316238690 TSecr=2680708464",,,,,,,,,,,,,19.56604156,19.56600466,0.001609089,3.69E-05,0.001572187
373,19.56604156,192.168.1.2,192.168.1.1,TCP,66,5001  >  54384 [ACK] Seq=1 Ack=101361 Win=102912 Len=0 TSval=2680708464 TSecr=316238690,,,,,,,,,,,,,19.56765065,19.56604156,-0.001600706,0.001609089,-0.003209795
374,19.56765065,192.168.1.1,192.168.1.2,TCP,11650,"54384  >  5001 [PSH, ACK] Seq=198377 Ack=1 Win=42496 Len=11584 TSval=316238692 TSecr=2680708466",,,,,,,,,,,,,19.56604994,19.56765065,1.97E-05,-0.001600706,0.001620356
375,19.56604994,192.168.1.1,192.168.1.2,TCP,7306,"[TCP Retransmission] 54384  >  5001 [PSH, ACK] Seq=137561 Ack=1 Win=42496 Len=7240 TSval=316238690 TSecr=2680708464",,,,,,,,,,,,,19.56606959,19.56604994,0.001593694,1.97E-05,0.001574044
376,19.56606959,192.168.1.2,192.168.1.1,TCP,66,5001  >  54384 [ACK] Seq=1 Ack=112945 Win=125952 Len=0 TSval=2680708464 TSecr=316238690,,,,,,,,,,,,,19.56766329,19.56606959,-0.001586178,0.001593694,-0.003179872
377,19.56766329,192.168.1.1,192.168.1.2,TCP,21786,"54384  >  5001 [PSH, ACK] Seq=209961 Ack=1 Win=42496 Len=21720 TSval=316238692 TSecr=2680708466",,,,,,,,,,,,,19.56607711,19.56766329,0.001600635,-0.001586178,0.003186813
378,19.56607711,192.168.1.1,192.168.1.2,TCP,21786,"[TCP Retransmission] 54384  >  5001 [PSH, ACK] Seq=144801 Ack=1 Win=42496 Len=21720 TSval=316238690 TSecr=2680708464",,,,,,,,,,,,,19.56767775,19.56607711,-0.00159678,0.001600635,-0.003197415
379,19.56767775,192.168.1.1,192.168.1.2,TCP,21786,"54384  >  5001 [PSH, ACK] Seq=231681 Ack=1 Win=42496 Len=21720 TSval=316238692 TSecr=2680708466",,,,,,,,,,,,,19.56608097,19.56767775,3.60E-05,-0.00159678,0.001632761
380,19.56608097,192.168.1.1,192.168.1.2,TCP,5858,"[TCP Retransmission] 54384  >  5001 [PSH, ACK] Seq=166521 Ack=1 Win=42496 Len=5792 TSval=316238690 TSecr=2680708464",,,,,,,,,,,,,19.56611695,19.56608097,1.33E-05,3.60E-05,-2.27E-05
381,19.56611695,192.168.1.2,192.168.1.1,TCP,66,5001  >  54384 [ACK] Seq=1 Ack=123081 Win=146432 Len=0 TSval=2680708464 TSecr=316238690,,,,,,,,,,,,,19.56613022,19.56611695,7.87E-06,1.33E-05,-5.40E-06
382,19.56613022,192.168.1.2,192.168.1.1,TCP,66,5001  >  54384 [ACK] Seq=1 Ack=137561 Win=158208 Len=0 TSval=2680708464 TSecr=316238690,,,,,,,,,,,,,19.56613809,19.56613022,4.55E-06,7.87E-06,-3.32E-06
383,19.56613809,192.168.1.1,192.168.1.2,TCP,15994,"[TCP Retransmission] 54384  >  5001 [PSH, ACK] Seq=172313 Ack=1 Win=42496 Len=15928 TSval=316238690 TSecr=2680708464",,,,,,,,,,,,,19.56614264,19.56613809,0.001438864,4.55E-06,0.001434314
384,19.56614264,192.168.1.1,192.168.1.2,TCP,10202,"[TCP Retransmission] 54384  >  5001 [PSH, ACK] Seq=188241 Ack=1 Win=42496 Len=10136 TSval=316238690 TSecr=2680708464",,,,,,,,,,,,,19.5675815,19.56614264,3.88E-05,0.001438864,-0.00140011
385,19.5675815,192.168.1.2,192.168.1.1,TCP,66,5001  >  54384 [ACK] Seq=1 Ack=198377 Win=158208 Len=0 TSval=2680708466 TSecr=316238690,,,,,,,,,,,,,19.56762026,19.5675815,4.49E-06,3.88E-05,-3.43E-05
386,19.56762026,192.168.1.1,192.168.1.2,TCP,11650,"[TCP Retransmission] 54384  >  5001 [PSH, ACK] Seq=198377 Ack=1 Win=42496 Len=11584 TSval=316238692 TSecr=2680708466",,,,,,,,,,,,,19.56762475,19.56762026,1.88E-06,4.49E-06,-2.61E-06
387,19.56762475,192.168.1.1,192.168.1.2,TCP,21786,"[TCP Retransmission] 54384  >  5001 [PSH, ACK] Seq=209961 Ack=1 Win=42496 Len=21720 TSval=316238692 TSecr=2680708466",,,,,,,,,,,,,19.56762663,19.56762475,0.000379959,1.88E-06,0.000378075
388,19.56762663,192.168.1.1,192.168.1.2,TCP,21786,"[TCP Retransmission] 54384  >  5001 [PSH, ACK] Seq=231681 Ack=1 Win=42496 Len=21720 TSval=316238692 TSecr=2680708466",,,,,,,,,,,,,19.56800659,19.56762663,5.26E-05,0.000379959,-0.000327379
389,19.56800659,192.168.1.1,192.168.1.2,TCP,8754,"54384  >  5001 [PSH, ACK] Seq=253401 Ack=1 Win=42496 Len=8688 TSval=316238692 TSecr=2680708466",,,,,,,,,,,,,19.56805917,19.56800659,0.001227723,5.26E-05,0.001175143
390,19.56805917,192.168.1.2,192.168.1.1,TCP,66,5001  >  54384 [ACK] Seq=1 Ack=209961 Win=181248 Len=0 TSval=2680708466 TSecr=316238692,,,,,,,,,,,,,19.56928689,19.56805917,0.000157732,0.001227723,-0.001069991
391,19.56928689,192.168.1.1,192.168.1.2,TCP,11650,"54384  >  5001 [PSH, ACK] Seq=262089 Ack=1 Win=42496 Len=11584 TSval=316238693 TSecr=2680708466",,,,,,,,,,,,,19.56944463,19.56928689,3.67E-05,0.000157732,-0.000120984
392,19.56944463,192.168.1.2,192.168.1.1,TCP,66,5001  >  54384 [ACK] Seq=1 Ack=231681 Win=224768 Len=0 TSval=2680708468 TSecr=316238692,,,,,,,,,,,,,19.56948137,19.56944463,1.15E-05,3.67E-05,-2.53E-05
393,19.56948137,192.168.1.1,192.168.1.2,TCP,1514,54384  >  5001 [ACK] Seq=273673 Ack=1 Win=42496 Len=1448 TSval=316238694 TSecr=2680708468,,,,,,,,,,,,,19.56949284,19.56948137,1.96E-05,1.15E-05,8.16E-06
394,19.56949284,192.168.1.1,192.168.1.2,TCP,21786,"54384  >  5001 [PSH, ACK] Seq=275121 Ack=1 Win=42496 Len=21720 TSval=316238694 TSecr=2680708468",,,,,,,,,,,,,19.56951247,19.56949284,2.30E-05,1.96E-05,3.40E-06
395,19.56951247,192.168.1.2,192.168.1.1,TCP,66,5001  >  54384 [ACK] Seq=1 Ack=253401 Win=268288 Len=0 TSval=2680708468 TSecr=316238692,,,,,,,,,,,,,19.5695355,19.56951247,1.47E-05,2.30E-05,-8.35E-06
396,19.5695355,192.168.1.1,192.168.1.2,TCP,21786,"54384  >  5001 [PSH, ACK] Seq=296841 Ack=1 Win=42496 Len=21720 TSval=316238694 TSecr=2680708468",,,,,,,,,,,,,19.56955018,19.5695355,2.11E-05,1.47E-05,6.42E-06
397,19.56955018,192.168.1.2,192.168.1.1,TCP,66,5001  >  54384 [ACK] Seq=1 Ack=262089 Win=285696 Len=0 TSval=2680708468 TSecr=316238692,,,,,,,,,,,,,19.56957128,19.56955018,1.20E-05,2.11E-05,-9.10E-06
398,19.56957128,192.168.1.1,192.168.1.2,TCP,10202,"54384  >  5001 [PSH, ACK] Seq=318561 Ack=1 Win=42496 Len=10136 TSval=316238694 TSecr=2680708468",,,,,,,,,,,,,19.56958328,19.56957128,1.88E-05,1.20E-05,6.80E-06
399,19.56958328,192.168.1.2,192.168.1.1,TCP,66,5001  >  54384 [ACK] Seq=1 Ack=273673 Win=308736 Len=0 TSval=2680708468 TSecr=316238693,,,,,,,,,,,,,19.56960208,19.56958328,1.21E-05,1.88E-05,-6.66E-06
400,19.56960208,192.168.1.1,192.168.1.2,TCP,11650,"54384  >  5001 [PSH, ACK] Seq=328697 Ack=1 Win=42496 Len=11584 TSval=316238694 TSecr=2680708468",,,,,,,,,,,,,19.56961422,19.56960208,1.65E-05,1.21E-05,4.32E-06
401,19.56961422,192.168.1.2,192.168.1.1,TCP,66,5001  >  54384 [ACK] Seq=1 Ack=275121 Win=311808 Len=0 TSval=2680708468 TSecr=316238694,,,,,,,,,,,,,19.56963068,19.56961422,9.07E-06,1.65E-05,-7.39E-06
402,19.56963068,192.168.1.1,192.168.1.2,TCP,1514,54384  >  5001 [ACK] Seq=340281 Ack=1 Win=42496 Len=1448 TSval=316238694 TSecr=2680708468,,,,,,,,,,,,,19.56963975,19.56963068,2.66E-05,9.07E-06,1.75E-05
403,19.56963975,192.168.1.2,192.168.1.1,TCP,66,5001  >  54384 [ACK] Seq=1 Ack=296841 Win=355328 Len=0 TSval=2680708468 TSecr=316238694,,,,,,,,,,,,,19.56966634,19.56963975,9.48E-06,2.66E-05,-1.71E-05
404,19.56966634,192.168.1.1,192.168.1.2,TCP,20338,"54384  >  5001 [PSH, ACK] Seq=341729 Ack=1 Win=42496 Len=20272 TSval=316238694 TSecr=2680708468",,,,,,,,,,,,,19.56967582,19.56966634,7.49E-05,9.48E-06,6.55E-05
405,19.56967582,192.168.1.1,192.168.1.2,TCP,2962,"54384  >  5001 [PSH, ACK] Seq=362001 Ack=1 Win=42496 Len=2896 TSval=316238694 TSecr=2680708468",,,,,,,,,,,,,19.56975077,19.56967582,6.00E-05,7.49E-05,-1.50E-05
406,19.56975077,192.168.1.2,192.168.1.1,TCP,66,5001  >  54384 [ACK] Seq=1 Ack=318561 Win=398848 Len=0 TSval=2680708468 TSecr=316238694,,,,,,,,,,,,,19.56981075,19.56975077,1.73E-05,6.00E-05,-4.27E-05
407,19.56981075,192.168.1.1,192.168.1.2,TCP,23234,"54384  >  5001 [PSH, ACK] Seq=364897 Ack=1 Win=42496 Len=23168 TSval=316238694 TSecr=2680708468",,,,,,,,,,,,,19.56982804,19.56981075,2.18E-05,1.73E-05,4.47E-06
408,19.56982804,192.168.1.2,192.168.1.1,TCP,66,5001  >  54384 [ACK] Seq=1 Ack=328697 Win=418816 Len=0 TSval=2680708468 TSecr=316238694,,,,,,,,,,,,,19.5698498,19.56982804,1.42E-05,2.18E-05,-7.61E-06
409,19.5698498,192.168.1.1,192.168.1.2,TCP,10202,"54384  >  5001 [PSH, ACK] Seq=388065 Ack=1 Win=42496 Len=10136 TSval=316238694 TSecr=2680708468",,,,,,,,,,,,,19.56986395,19.5698498,2.14E-05,1.42E-05,7.23E-06
410,19.56986395,192.168.1.2,192.168.1.1,TCP,66,5001  >  54384 [ACK] Seq=1 Ack=340281 Win=442368 Len=0 TSval=2680708468 TSecr=316238694,,,,,,,,,,,,,19.56988533,19.56986395,1.18E-05,2.14E-05,-9.56E-06
411,19.56988533,192.168.1.1,192.168.1.2,TCP,13098,"54384  >  5001 [PSH, ACK] Seq=398201 Ack=1 Win=42496 Len=13032 TSval=316238694 TSecr=2680708468",,,,,,,,,,,,,19.56989715,19.56988533,1.32E-05,1.18E-05,1.40E-06
412,19.56989715,192.168.1.2,192.168.1.1,TCP,66,5001  >  54384 [ACK] Seq=1 Ack=341729 Win=444928 Len=0 TSval=2680708468 TSecr=316238694,,,,,,,,,,,,,19.56991037,19.56989715,2.18E-05,1.32E-05,8.61E-06
413,19.56991037,192.168.1.2,192.168.1.1,TCP,66,5001  >  54384 [ACK] Seq=1 Ack=362001 Win=485376 Len=0 TSval=2680708468 TSecr=316238694,,,,,,,,,,,,,19.5699322,19.56991037,1.21E-05,2.18E-05,-9.77E-06
414,19.5699322,192.168.1.1,192.168.1.2,TCP,15994,"54384  >  5001 [PSH, ACK] Seq=411233 Ack=1 Win=42496 Len=15928 TSval=316238694 TSecr=2680708468",,,,,,,,,,,,,19.56994426,19.5699322,1.84E-05,1.21E-05,6.39E-06
415,19.56994426,192.168.1.2,192.168.1.1,TCP,66,5001  >  54384 [ACK] Seq=1 Ack=364897 Win=491520 Len=0 TSval=2680708468 TSecr=316238694,,,,,,,,,,,,,19.5699627,19.56994426,1.08E-05,1.84E-05,-7.64E-06
416,19.5699627,192.168.1.1,192.168.1.2,TCP,8754,"54384  >  5001 [PSH, ACK] Seq=427161 Ack=1 Win=42496 Len=8688 TSval=316238694 TSecr=2680708468",,,,,,,,,,,,,19.5699735,19.5699627,2.52E-05,1.08E-05,1.44E-05
417,19.5699735,192.168.1.2,192.168.1.1,TCP,66,5001  >  54384 [ACK] Seq=1 Ack=388065 Win=537600 Len=0 TSval=2680708468 TSecr=316238694,,,,,,,,,,,,,19.56999869,19.5699735,1.42E-05,2.52E-05,-1.10E-05
418,19.56999869,192.168.1.1,192.168.1.2,TCP,24682,"54384  >  5001 [PSH, ACK] Seq=435849 Ack=1 Win=42496 Len=24616 TSval=316238694 TSecr=2680708468",,,,,,,,,,,,,19.57001285,19.56999869,1.88E-05,1.42E-05,4.62E-06
419,19.57001285,192.168.1.2,192.168.1.1,TCP,66,5001  >  54384 [ACK] Seq=1 Ack=398201 Win=558080 Len=0 TSval=2680708468 TSecr=316238694,,,,,,,,,,,,,19.57003163,19.57001285,1.21E-05,1.88E-05,-6.69E-06
420,19.57003163,192.168.1.1,192.168.1.2,TCP,11650,"54384  >  5001 [PSH, ACK] Seq=460465 Ack=1 Win=42496 Len=11584 TSval=316238694 TSecr=2680708468",,,,,,,,,,,,,19.57004373,19.57003163,1.93E-05,1.21E-05,7.19E-06
421,19.57004373,192.168.1.2,192.168.1.1,TCP,66,5001  >  54384 [ACK] Seq=1 Ack=411233 Win=584192 Len=0 TSval=2680708468 TSecr=316238694,,,,,,,,,,,,,19.57006301,19.57004373,1.25E-05,1.93E-05,-6.83E-06
422,19.57006301,192.168.1.1,192.168.1.2,TCP,13098,"54384  >  5001 [PSH, ACK] Seq=472049 Ack=1 Win=42496 Len=13032 TSval=316238694 TSecr=2680708468",,,,,,,,,,,,,19.57007547,19.57006301,2.16E-05,1.25E-05,9.11E-06
423,19.57007547,192.168.1.2,192.168.1.1,TCP,66,5001  >  54384 [ACK] Seq=1 Ack=427161 Win=615936 Len=0 TSval=2680708468 TSecr=316238694,,,,,,,,,,,,,19.57009704,19.57007547,8.19E-06,2.16E-05,-1.34E-05
424,19.57009704,192.168.1.1,192.168.1.2,TCP,7306,"54384  >  5001 [PSH, ACK] Seq=485081 Ack=1 Win=42496 Len=7240 TSval=316238694 TSecr=2680708468",,,,,,,,,,,,,19.57010524,19.57009704,1.17E-05,8.19E-06,3.55E-06
425,19.57010524,192.168.1.1,192.168.1.2,TCP,10202,"54384  >  5001 [PSH, ACK] Seq=492321 Ack=1 Win=42496 Len=10136 TSval=316238694 TSecr=2680708468",,,,,,,,,,,,,19.57011698,19.57010524,0.000119399,1.17E-05,0.000107658
426,19.57011698,192.168.1.2,192.168.1.1,TCP,66,5001  >  54384 [ACK] Seq=1 Ack=435849 Win=633344 Len=0 TSval=2680708468 TSecr=316238694,,,,,,,,,,,,,19.57023638,19.57011698,0.001938417,0.000119399,0.001819018
427,19.57023638,192.168.1.1,192.168.1.2,TCP,8754,"54384  >  5001 [PSH, ACK] Seq=502457 Ack=1 Win=42496 Len=8688 TSval=316238694 TSecr=2680708468",,,,,,,,,,,,,19.57217479,19.57023638,7.81E-05,0.001938417,-0.001860327
428,19.57217479,192.168.1.2,192.168.1.1,TCP,66,5001  >  54384 [ACK] Seq=1 Ack=460465 Win=682496 Len=0 TSval=2680708470 TSecr=316238694,,,,,,,,,,,,,19.57225288,19.57217479,1.91E-05,7.81E-05,-5.90E-05
429,19.57225288,192.168.1.1,192.168.1.2,TCP,26130,"54384  >  5001 [PSH, ACK] Seq=511145 Ack=1 Win=42496 Len=26064 TSval=316238696 TSecr=2680708470",,,,,,,,,,,,,19.57227195,19.57225288,1.34E-05,1.91E-05,-5.69E-06
430,19.57227195,192.168.1.2,192.168.1.1,TCP,66,5001  >  54384 [ACK] Seq=1 Ack=472049 Win=705536 Len=0 TSval=2680708470 TSecr=316238694,,,,,,,,,,,,,19.57228533,19.57227195,2.26E-05,1.34E-05,9.20E-06
431,19.57228533,192.168.1.2,192.168.1.1,TCP,66,5001  >  54384 [ACK] Seq=1 Ack=485081 Win=731648 Len=0 TSval=2680708470 TSecr=316238694,,,,,,,,,,,,,19.57230791,19.57228533,1.42E-05,2.26E-05,-8.34E-06
432,19.57230791,192.168.1.1,192.168.1.2,TCP,26130,"54384  >  5001 [PSH, ACK] Seq=537209 Ack=1 Win=42496 Len=26064 TSval=316238696 TSecr=2680708470",,,,,,,,,,,,,19.57232215,19.57230791,1.41E-05,1.42E-05,-9.70E-08
433,19.57232215,192.168.1.2,192.168.1.1,TCP,66,5001  >  54384 [ACK] Seq=1 Ack=492321 Win=745984 Len=0 TSval=2680708470 TSecr=316238694,,,,,,,,,,,,,19.57233629,19.57232215,-0.004705415,1.41E-05,-0.004719556
434,19.57233629,192.168.1.2,192.168.1.1,TCP,66,5001  >  54384 [ACK] Seq=1 Ack=502457 Win=766464 Len=0 TSval=2680708470 TSecr=316238694,,,,,,,,,,,,,19.56763088,19.57233629,0.004724484,-0.004705415,0.009429899
435,19.56763088,192.168.1.1,192.168.1.2,TCP,8754,"[TCP Spurious Retransmission] 54384  >  5001 [PSH, ACK] Seq=253401 Ack=1 Win=42496 Len=8688 TSval=316238692 TSecr=2680708466",,,,,,,,,,,,,19.57235536,19.56763088,-0.004290499,0.004724484,-0.009014983
436,19.57235536,192.168.1.1,192.168.1.2,TCP,13098,"54384  >  5001 [PSH, ACK] Seq=563273 Ack=1 Win=42496 Len=13032 TSval=316238696 TSecr=2680708470",,,,,,,,,,,,,19.56806486,19.57235536,0.004303204,-0.004290499,0.008593703
437,19.56806486,192.168.1.2,192.168.1.1,TCP,66,5001  >  54384 [ACK] Seq=1 Ack=209961 Win=181248 Len=0 TSval=2680708466 TSecr=316238692,,,,,,,,,,,,,19.57236807,19.56806486,-0.003109955,0.004303204,-0.007413159
438,19.57236807,192.168.1.2,192.168.1.1,TCP,66,5001  >  54384 [ACK] Seq=1 Ack=511145 Win=783872 Len=0 TSval=2680708470 TSecr=316238694,,,,,,,,,,,,,19.56925811,19.57236807,0.003130215,-0.003109955,0.00624017
439,19.56925811,192.168.1.1,192.168.1.2,TCP,11650,"[TCP Spurious Retransmission] 54384  >  5001 [PSH, ACK] Seq=262089 Ack=1 Win=42496 Len=11584 TSval=316238693 TSecr=2680708466",,,,,,,,,,,,,19.57238833,19.56925811,-0.002936983,0.003130215,-0.006067198
440,19.57238833,192.168.1.1,192.168.1.2,TCP,13098,"54384  >  5001 [PSH, ACK] Seq=576305 Ack=1 Win=42496 Len=13032 TSval=316238697 TSecr=2680708470",,,,,,,,,,,,,19.56945134,19.57238833,0.002949072,-0.002936983,0.005886055
441,19.56945134,192.168.1.2,192.168.1.1,TCP,66,5001  >  54384 [ACK] Seq=1 Ack=231681 Win=224768 Len=0 TSval=2680708468 TSecr=316238692,,,,,,,,,,,,,19.57240042,19.56945134,-0.002928682,0.002949072,-0.005877754
442,19.57240042,192.168.1.2,192.168.1.1,TCP,66,5001  >  54384 [ACK] Seq=1 Ack=537209 Win=836096 Len=0 TSval=2680708471 TSecr=316238696,,,,,,,,,,,,,19.56947173,19.57240042,0.00296744,-0.002928682,0.005896122
443,19.56947173,192.168.1.1,192.168.1.2,TCP,1514,[TCP Spurious Retransmission] 54384  >  5001 [ACK] Seq=273673 Ack=1 Win=42496 Len=1448 TSval=316238694 TSecr=2680708468,,,,,,,,,,,,,19.57243917,19.56947173,1.78E-05,0.00296744,-0.002949682
444,19.57243917,192.168.1.1,192.168.1.2,TCP,27578,"54384  >  5001 [PSH, ACK] Seq=589337 Ack=1 Win=42496 Len=27512 TSval=316238697 TSecr=2680708471",,,,,,,,,,,,,19.57245693,19.57243917,2.71E-05,1.78E-05,9.31E-06
445,19.57245693,192.168.1.2,192.168.1.1,TCP,66,5001  >  54384 [ACK] Seq=1 Ack=563273 Win=888320 Len=0 TSval=2680708471 TSecr=316238696,,,,,,,,,,,,,19.572484,19.57245693,-0.003008519,2.71E-05,-0.003035589
446,19.572484,192.168.1.1,192.168.1.2,TCP,24682,"54384  >  5001 [PSH, ACK] Seq=616849 Ack=1 Win=42496 Len=24616 TSval=316238697 TSecr=2680708471",,,,,,,,,,,,,19.56947548,19.572484,0.003018647,-0.003008519,0.006027166
447,19.56947548,192.168.1.1,192.168.1.2,TCP,21786,"[TCP Spurious Retransmission] 54384  >  5001 [PSH, ACK] Seq=275121 Ack=1 Win=42496 Len=21720 TSval=316238694 TSecr=2680708468",,,,,,,,,,,,,19.57249413,19.56947548,1.08E-05,0.003018647,-0.003007858
448,19.57249413,192.168.1.1,192.168.1.2,TCP,2962,"54384  >  5001 [PSH, ACK] Seq=641465 Ack=1 Win=42496 Len=2896 TSval=316238697 TSecr=2680708471",,,,,,,,,,,,,19.57250492,19.57249413,-0.002989748,1.08E-05,-0.003000537
449,19.57250492,192.168.1.2,192.168.1.1,TCP,66,5001  >  54384 [ACK] Seq=1 Ack=576305 Win=913920 Len=0 TSval=2680708471 TSecr=316238696,,,,,,,,,,,,,19.56951517,19.57250492,7.95E-06,-0.002989748,0.002997702
450,19.56951517,192.168.1.2,192.168.1.1,TCP,66,5001  >  54384 [ACK] Seq=1 Ack=253401 Win=268288 Len=0 TSval=2680708468 TSecr=316238692,,,,,,,,,,,,,19.56952312,19.56951517,3.00E-05,7.95E-06,2.21E-05
451,19.56952312,192.168.1.1,192.168.1.2,TCP,21786,"[TCP Retransmission] 54384  >  5001 [PSH, ACK] Seq=296841 Ack=1 Win=42496 Len=21720 TSval=316238694 TSecr=2680708468",,,,,,,,,,,,,19.56955316,19.56952312,1.00E-05,3.00E-05,-2.00E-05
452,19.56955316,192.168.1.2,192.168.1.1,TCP,66,5001  >  54384 [ACK] Seq=1 Ack=262089 Win=285696 Len=0 TSval=2680708468 TSecr=316238692,,,,,,,,,,,,,19.56956317,19.56955316,2.27E-05,1.00E-05,1.27E-05
453,19.56956317,192.168.1.1,192.168.1.2,TCP,10202,"[TCP Retransmission] 54384  >  5001 [PSH, ACK] Seq=318561 Ack=1 Win=42496 Len=10136 TSval=316238694 TSecr=2680708468",,,,,,,,,,,,,19.56958589,19.56956317,8.06E-06,2.27E-05,-1.47E-05
454,19.56958589,192.168.1.2,192.168.1.1,TCP,66,5001  >  54384 [ACK] Seq=1 Ack=273673 Win=308736 Len=0 TSval=2680708468 TSecr=316238693,,,,,,,,,,,,,19.56959396,19.56958589,2.29E-05,8.06E-06,1.48E-05
455,19.56959396,192.168.1.1,192.168.1.2,TCP,11650,"[TCP Retransmission] 54384  >  5001 [PSH, ACK] Seq=328697 Ack=1 Win=42496 Len=11584 TSval=316238694 TSecr=2680708468",,,,,,,,,,,,,19.56961684,19.56959396,8.80E-06,2.29E-05,-1.41E-05
456,19.56961684,192.168.1.2,192.168.1.1,TCP,66,5001  >  54384 [ACK] Seq=1 Ack=275121 Win=311808 Len=0 TSval=2680708468 TSecr=316238694,,,,,,,,,,,,,19.56962564,19.56961684,1.66E-05,8.80E-06,7.81E-06
457,19.56962564,192.168.1.1,192.168.1.2,TCP,1514,[TCP Retransmission] 54384  >  5001 [ACK] Seq=340281 Ack=1 Win=42496 Len=1448 TSval=316238694 TSecr=2680708468,,,,,,,,,,,,,19.56964225,19.56962564,0.00288435,1.66E-05,0.00286774
458,19.56964225,192.168.1.2,192.168.1.1,TCP,66,5001  >  54384 [ACK] Seq=1 Ack=296841 Win=355328 Len=0 TSval=2680708468 TSecr=316238694,,,,,,,,,,,,,19.5725266,19.56964225,-0.002876862,0.00288435,-0.005761212
459,19.5725266,192.168.1.1,192.168.1.2,TCP,14546,"54384  >  5001 [PSH, ACK] Seq=644361 Ack=1 Win=42496 Len=14480 TSval=316238697 TSecr=2680708471",,,,,,,,,,,,,19.56964974,19.5725266,0.002890826,-0.002876862,0.005767688
460,19.56964974,192.168.1.1,192.168.1.2,TCP,20338,"[TCP Retransmission] 54384  >  5001 [PSH, ACK] Seq=341729 Ack=1 Win=42496 Len=20272 TSval=316238694 TSecr=2680708468",,,,,,,,,,,,,19.57254056,19.56964974,-0.002886744,0.002890826,-0.00577757
461,19.57254056,192.168.1.2,192.168.1.1,TCP,66,5001  >  54384 [ACK] Seq=1 Ack=589337 Win=940032 Len=0 TSval=2680708471 TSecr=316238697,,,,,,,,,,,,,19.56965382,19.57254056,0.000108998,-0.002886744,0.002995742
462,19.56965382,192.168.1.1,192.168.1.2,TCP,2962,"[TCP Spurious Retransmission] 54384  >  5001 [PSH, ACK] Seq=362001 Ack=1 Win=42496 Len=2896 TSval=316238694 TSecr=2680708468",,,,,,,,,,,,,19.56976282,19.56965382,1.95E-05,0.000108998,-8.95E-05
463,19.56976282,192.168.1.2,192.168.1.1,TCP,66,5001  >  54384 [ACK] Seq=1 Ack=318561 Win=398848 Len=0 TSval=2680708468 TSecr=316238694,,,,,,,,,,,,,19.5697823,19.56976282,0.002779111,1.95E-05,0.002759627
464,19.5697823,192.168.1.1,192.168.1.2,TCP,23234,"[TCP Retransmission] 54384  >  5001 [PSH, ACK] Seq=364897 Ack=1 Win=42496 Len=23168 TSval=316238694 TSecr=2680708468",,,,,,,,,,,,,19.57256141,19.5697823,-0.002730946,0.002779111,-0.005510057
465,19.57256141,192.168.1.1,192.168.1.2,TCP,13098,"54384  >  5001 [PSH, ACK] Seq=658841 Ack=1 Win=42496 Len=13032 TSval=316238697 TSecr=2680708471",,,,,,,,,,,,,19.56983047,19.57256141,0.002743262,-0.002730946,0.005474208
466,19.56983047,192.168.1.2,192.168.1.1,TCP,66,5001  >  54384 [ACK] Seq=1 Ack=328697 Win=418816 Len=0 TSval=2680708468 TSecr=316238694,,,,,,,,,,,,,19.57257373,19.56983047,-0.002732945,0.002743262,-0.005476207
467,19.57257373,192.168.1.2,192.168.1.1,TCP,66,5001  >  54384 [ACK] Seq=1 Ack=616849 Win=995328 Len=0 TSval=2680708471 TSecr=316238697,,,,,,,,,,,,,19.56984078,19.57257373,2.58E-05,-0.002732945,0.002758735
468,19.56984078,192.168.1.1,192.168.1.2,TCP,10202,"[TCP Spurious Retransmission] 54384  >  5001 [PSH, ACK] Seq=388065 Ack=1 Win=42496 Len=10136 TSval=316238694 TSecr=2680708468",,,,,,,,,,,,,19.56986657,19.56984078,9.33E-06,2.58E-05,-1.65E-05
469,19.56986657,192.168.1.2,192.168.1.1,TCP,66,5001  >  54384 [ACK] Seq=1 Ack=340281 Win=442368 Len=0 TSval=2680708468 TSecr=316238694,,,,,,,,,,,,,19.5698759,19.56986657,2.37E-05,9.33E-06,1.43E-05
470,19.5698759,192.168.1.1,192.168.1.2,TCP,13098,"[TCP Retransmission] 54384  >  5001 [PSH, ACK] Seq=398201 Ack=1 Win=42496 Len=13032 TSval=316238694 TSecr=2680708468",,,,,,,,,,,,,19.56989955,19.5698759,0.002701097,2.37E-05,0.002677445
471,19.56989955,192.168.1.2,192.168.1.1,TCP,66,5001  >  54384 [ACK] Seq=1 Ack=341729 Win=444928 Len=0 TSval=2680708468 TSecr=316238694,,,,,,,,,,,,,19.57260065,19.56989955,-0.002687375,0.002701097,-0.005388472
472,19.57260065,192.168.1.1,192.168.1.2,TCP,29026,"54384  >  5001 [PSH, ACK] Seq=671873 Ack=1 Win=42496 Len=28960 TSval=316238697 TSecr=2680708471",,,,,,,,,,,,,19.56991327,19.57260065,0.002703683,-0.002687375,0.005391058
473,19.56991327,192.168.1.2,192.168.1.1,TCP,66,5001  >  54384 [ACK] Seq=1 Ack=362001 Win=485376 Len=0 TSval=2680708468 TSecr=316238694,,,,,,,,,,,,,19.57261696,19.56991327,-0.002695738,0.002703683,-0.005399421
474,19.57261696,192.168.1.2,192.168.1.1,TCP,66,5001  >  54384 [ACK] Seq=1 Ack=641465 Win=1044480 Len=0 TSval=2680708471 TSecr=316238697,,,,,,,,,,,,,19.56992122,19.57261696,0.002716608,-0.002695738,0.005412346
475,19.56992122,192.168.1.1,192.168.1.2,TCP,15994,"[TCP Spurious Retransmission] 54384  >  5001 [PSH, ACK] Seq=411233 Ack=1 Win=42496 Len=15928 TSval=316238694 TSecr=2680708468",,,,,,,,,,,,,19.57263783,19.56992122,-0.002690755,0.002716608,-0.005407363
476,19.57263783,192.168.1.1,192.168.1.2,TCP,5858,"54384  >  5001 [PSH, ACK] Seq=700833 Ack=1 Win=42496 Len=5792 TSval=316238697 TSecr=2680708471",,,,,,,,,,,,,19.56994707,19.57263783,8.98E-06,-0.002690755,0.00269973
477,19.56994707,192.168.1.2,192.168.1.1,TCP,66,5001  >  54384 [ACK] Seq=1 Ack=364897 Win=491520 Len=0 TSval=2680708468 TSecr=316238694,,,,,,,,,,,,,19.56995605,19.56994707,2.01E-05,8.98E-06,1.11E-05
478,19.56995605,192.168.1.1,192.168.1.2,TCP,8754,"[TCP Retransmission] 54384  >  5001 [PSH, ACK] Seq=427161 Ack=1 Win=42496 Len=8688 TSval=316238694 TSecr=2680708468",,,,,,,,,,,,,19.56997611,19.56995605,9.48E-06,2.01E-05,-1.06E-05
479,19.56997611,192.168.1.2,192.168.1.1,TCP,66,5001  >  54384 [ACK] Seq=1 Ack=388065 Win=537600 Len=0 TSval=2680708468 TSecr=316238694,,,,,,,,,,,,,19.5699856,19.56997611,0.00266532,9.48E-06,0.002655836
480,19.5699856,192.168.1.1,192.168.1.2,TCP,24682,"[TCP Retransmission] 54384  >  5001 [PSH, ACK] Seq=435849 Ack=1 Win=42496 Len=24616 TSval=316238694 TSecr=2680708468",,,,,,,,,,,,,19.57265092,19.5699856,-0.002635531,0.00266532,-0.005300851
481,19.57265092,192.168.1.1,192.168.1.2,TCP,20338,"54384  >  5001 [PSH, ACK] Seq=706625 Ack=1 Win=42496 Len=20272 TSval=316238697 TSecr=2680708471",,,,,,,,,,,,,19.57001538,19.57265092,0.002651861,-0.002635531,0.005287392
482,19.57001538,192.168.1.2,192.168.1.1,TCP,66,5001  >  54384 [ACK] Seq=1 Ack=398201 Win=558080 Len=0 TSval=2680708468 TSecr=316238694,,,,,,,,,,,,,19.57266725,19.57001538,1.70E-05,0.002651861,-0.002634893
483,19.57266725,192.168.1.2,192.168.1.1,TCP,66,5001  >  54384 [ACK] Seq=1 Ack=644361 Win=1050112 Len=0 TSval=2680708471 TSecr=316238697,,,,,,,,,,,,,19.57268421,19.57266725,-0.002659993,1.70E-05,-0.002676961
484,19.57268421,192.168.1.1,192.168.1.2,TCP,2962,"54384  >  5001 [PSH, ACK] Seq=726897 Ack=1 Win=42496 Len=2896 TSval=316238697 TSecr=2680708471",,,,,,,,,,,,,19.57002422,19.57268421,0.00266986,-0.002659993,0.005329853
485,19.57002422,192.168.1.1,192.168.1.2,TCP,11650,"[TCP Spurious Retransmission] 54384  >  5001 [PSH, ACK] Seq=460465 Ack=1 Win=42496 Len=11584 TSval=316238694 TSecr=2680708468",,,,,,,,,,,,,19.57269408,19.57002422,-0.002647618,0.00266986,-0.005317478
486,19.57269408,192.168.1.2,192.168.1.1,TCP,66,5001  >  54384 [ACK] Seq=1 Ack=658841 Win=1079296 Len=0 TSval=2680708471 TSecr=316238697,,,,,,,,,,,,,19.57004646,19.57269408,8.50E-06,-0.002647618,0.002656114
487,19.57004646,192.168.1.2,192.168.1.1,TCP,66,5001  >  54384 [ACK] Seq=1 Ack=411233 Win=584192 Len=0 TSval=2680708468 TSecr=316238694,,,,,,,,,,,,,19.57005496,19.57004646,2.33E-05,8.50E-06,1.48E-05
488,19.57005496,192.168.1.1,192.168.1.2,TCP,13098,"[TCP Retransmission] 54384  >  5001 [PSH, ACK] Seq=472049 Ack=1 Win=42496 Len=13032 TSval=316238694 TSecr=2680708468",,,,,,,,,,,,,19.57007826,19.57005496,7.93E-06,2.33E-05,-1.54E-05
489,19.57007826,192.168.1.2,192.168.1.1,TCP,66,5001  >  54384 [ACK] Seq=1 Ack=427161 Win=615936 Len=0 TSval=2680708468 TSecr=316238694,,,,,,,,,,,,,19.57008619,19.57007826,4.53E-06,7.93E-06,-3.40E-06
490,19.57008619,192.168.1.1,192.168.1.2,TCP,7306,"[TCP Retransmission] 54384  >  5001 [PSH, ACK] Seq=485081 Ack=1 Win=42496 Len=7240 TSval=316238694 TSecr=2680708468",,,,,,,,,,,,,19.57009072,19.57008619,2.89E-05,4.53E-06,2.44E-05
491,19.57009072,192.168.1.1,192.168.1.2,TCP,10202,"[TCP Retransmission] 54384  >  5001 [PSH, ACK] Seq=492321 Ack=1 Win=42496 Len=10136 TSval=316238694 TSecr=2680708468",,,,,,,,,,,,,19.57011966,19.57009072,9.13E-06,2.89E-05,-1.98E-05
